Headline,Links,Sentiment Score,Upload Date,Relative Time,Absolute Time
Trump Hails 'Total Reset' In US-China Trade Relations As Talks Continue,https://www.barrons.com/news/trump-hails-total-reset-in-us-china-trade-relations-as-talks-continue-3d99676f?refsec=topics_afp-news,0.0,1300,59,1241
Wary investors hope US-China talks will ease high-stakes trade war,https://www.business-standard.com/world-news/wary-investors-hope-us-china-talks-will-ease-high-stakes-trade-war-125051100055_1.html,0.128,1300,58,1242
"Mercer Global Advisors Inc. ADV Buys 6,790 Shares of Leidos Holdings, Inc. (NYSE:LDOS)",https://www.marketbeat.com/instant-alerts/mercer-global-advisors-inc-adv-purchases-6790-shares-of-leidos-holdings-inc-nyseldos-2025-05-05/,0.296,1300,56,1244
Meghan Markle shares PDA-filled date night with Prince Harry after saying couple's in 'honeymoon' phase,https://www.foxnews.com/entertainment/meghan-markle-shares-pda-filled-date-night-prince-harry-after-saying-couples-honeymoon-phase,0.296,1300,52,1248
Happy Mothers Day: Albaneses sweet tribute to late mum,https://www.skynews.com.au/australia-news/politics/prime-minister-anthony-albanese-shares-sweet-tribute-to-late-mum-as-australians-mark-mothers-day/news-story/523ec766e9ae33c962796688052f90f5,0.7717,1300,43,1257
"World's oldest living person, who is 115 years old, shares the one rule thats helped her live so long",https://timesofindia.indiatimes.com/life-style/health-fitness/health-news/worlds-oldest-living-person-who-is-115-years-old-shares-the-one-rule-thats-helped-her-live-so-long/photostory/120853459.cms,0.296,1300,43,1257
Trump hails 'total reset' in US-China trade relations as talks continue,https://economictimes.indiatimes.com/news/international/global-trends/trump-hails-total-reset-in-us-china-trade-relations-as-talks-continue/articleshow/121070997.cms?UTM_Source=Google_Newsstand&UTM_Campaign=RSS_Feed&UTM_Medium=Referral,0.0,1300,42,1258
Learn to Evaluate (BSJQ) using the Charts,https://news.stocktradersdaily.com/news_release/17/Learn+to+Evaluate+%28BSJQ%29+using+the+Charts_051025100001.html,0.0,1300,40,1260
(XSHG) Stock Evaluation Report (XSHG:CA),https://news.stocktradersdaily.com/canada/xshg-stock-evaluation-report_20250510_5af32e,0.0,1300,39,1261
"US electronics company stuck with unsellable stock after $36,000 tariff bill, announces price hike",https://www.livemint.com/technology/tech-news/us-electronics-company-stuck-with-unsellable-stock-after-36-000-tariff-bill-announces-price-hike-11746927491981.html,-0.25,1300,34,1266
(BSJU) Trading Report,https://news.stocktradersdaily.com/news_release/22/%28BSJU%29+Trading+Report_051025100601.html,0.0,1300,34,1266
(VSC) Strategic Equity Report (VSC:CA),https://news.stocktradersdaily.com/canada/vsc-strategic-equity-report_20250510_2ddcfb,0.0,1300,33,1267
Long Term Trading Analysis for (BSL),https://news.stocktradersdaily.com/news_release/23/Long+Term+Trading+Analysis+for+%28BSL%29_051025100802.html,0.0,1300,32,1268
How the (BPF.UN) price action is used to our Advantage (BPF.UN:CA),https://news.stocktradersdaily.com/canada/how-the-bpfun-price-action-is-used-to-our-advantage_20250510_078400,0.25,1300,31,1269
Kalyan Jewellers India Limited Earnings Missed Analyst Estimates: Here's What Analysts Are Forecasting Now,https://simplywall.st/stocks/in/consumer-durables/nse-kalyankjil/kalyan-jewellers-india-shares/news/kalyan-jewellers-india-limited-earnings-missed-analyst-estim,-0.4767,1300,31,1269
Why RH Stock Plummeted 22% in April,https://www.aol.com/why-rh-stock-plummeted-22-104641990.html,0.0,1300,31,1269
Stock market holidays 2025: Are NSE and BSE closed for Buddha Purnima on Monday?,https://www.msn.com/en-in/money/markets/stock-market-holidays-2025-are-nse-and-bse-closed-for-buddha-purnima-on-monday/ar-AA1ExrSq?ocid=finance-verthp-feeds,0.3818,1300,31,1269
Why Easterly Government Properties Stock Is Down Today,https://www.aol.com/finance/why-easterly-government-properties-stock-194803221.html,0.0,1300,27,1273
(VXC) Market Performance Analysis (VXC:CA),https://news.stocktradersdaily.com/canada/vxc-market-performance-analysis_20250510_bfeb19,0.0,1300,26,1274
Rebel Wilson Shares Rare Glimpse of Daughter Royce for Heartwarming Occasion,https://parade.com/news/rebel-wilson-rare-glimpse-daughter-royce-2025-mothers-day,0.5719,1300,23,1277
(BXF) Optimized Trading Opportunities (BXF:CA),https://news.stocktradersdaily.com/canada/bxf-optimized-trading-opportunities_20250510_e16acf,0.6808,1300,22,1278
"Nintendo Switch 2 Preorders: The Latest on Availability in the US, Canada and UK",https://www.cnet.com/deals/how-to-preorder-nintendo-switch-2-start-time-where-in-stock-guide/,0.0,1300,19,1281
Nintendo Switch 2 UK pre-orders live: Latest stock updates as Nintendo Store sells out,https://www.the-independent.com/extras/indybest/gadgets-tech/video-games-consoles/nintendo-switch-2-pre-order-uk-live-b2730856.html,0.0,1300,18,1282
(BSMV) Investment Analysis and Advice,https://news.stocktradersdaily.com/news_release/40/%28BSMV%29+Investment+Analysis+and+Advice_051025102402.html,0.0,1300,16,1284
Sonata Software Limited (NSE:SONATSOFTW) Just Released Its Annual Results And Analysts Are Updating Their Estimates,https://simplywall.st/stocks/in/software/nse-sonatsoftw/sonata-software-shares/news/sonata-software-limited-nsesonatsoftw-just-released-its-annu,-0.2263,1300,14,1286
Linde India Limited's (NSE:LINDEINDIA) stock price dropped 3.3% last week; public companies would not be happy,https://simplywall.st/stocks/in/materials/nse-lindeindia/linde-india-shares/news/linde-india-limiteds-nselindeindia-stock-price-dropped-33-la,-0.4585,1300,14,1286
(BSRR) Proactive Strategies,https://news.stocktradersdaily.com/news_release/43/%28BSRR%29+Proactive+Strategies_051025102601.html,0.4215,1300,14,1286
Senate Majority Leader John Thune Criticizes Democrats' Focus on Trump: Potential Impact on Crypto Market Sentiment,https://blockchain.news/flashnews/senate-majority-leader-john-thune-criticizes-democrats-focus-on-trump-potential-impact-on-crypto-market-sentiment,-0.34,1300,13,1287
Titan Company Limited Just Missed Earnings - But Analysts Have Updated Their Models,https://simplywall.st/stocks/in/consumer-durables/nse-titan/titan-shares/news/titan-company-limited-just-missed-earnings-but-analysts-have,-0.2617,1300,13,1287
Investors in Procter & Gamble Hygiene and Health Care (NSE:PGHH) have seen notable returns of 50% over the past five years,https://simplywall.st/stocks/in/household/nse-pghh/procter-gamble-hygiene-and-health-care-shares/news/investors-in-procter-gamble-hygiene-and-health-care-nsepghh,0.4939,1300,13,1287
Alkyl Amines Chemicals' (NSE:ALKYLAMINE) earnings growth rate lags the 19% CAGR delivered to shareholders,https://simplywall.st/stocks/in/materials/nse-alkylamine/alkyl-amines-chemicals-shares/news/alkyl-amines-chemicals-nsealkylamine-earnings-growth-rate-la-1,0.0258,1300,13,1287
"Apcotex Industries Limited (NSE:APCOTEXIND) Just Reported, And Analysts Assigned A 394 Price Target",https://simplywall.st/stocks/in/materials/nse-apcotexind/apcotex-industries-shares/news/apcotex-industries-limited-nseapcotexind-just-reported-and-a,-0.2263,1300,13,1287
Sonata Software Limited (NSE:SONATSOFTW) Just Released Its Annual Results And Analysts Are Updating Their Estimates,https://simplywall.st/stocks/in/software/nse-sonatsoftw/sonata-software-shares/news/sonata-software-limited-nsesonatsoftw-just-released-its-annu,-0.2263,1300,13,1287
"Travel: In a world of noise, silence becomes the ultimate luxury trip | Mint",https://www.livemint.com/mint-lounge/ideas/quiet-life-travel-lesser-known-locations-silent-experiences-wellness-11746782782963.html,0.0,1300,10,1290
Pune News: PMC Directs Pune Hospitals to Reserve 10% Beds for Emergencies,https://punemirror.com/pune/health/pune-news-pmc-directs-pune-hospitals-to-reserve-10-beds-for-emergencies/cid1746930991.htm,0.0,1300,9,1291
"India-Pakistan Conflict, The Ceasefire And Stock Markets",https://inc42.com/features/india-pakistan-conflict-stock-markets-ceasefire-panic/,-0.3182,1300,9,1291
China's car sales rise 14.8% in April,https://www.marketscreener.com/quote/stock/TESLA-INC-6344549/news/China-s-car-sales-rise-14-8-in-April-49905500/,0.0,1300,8,1292
